{
  "id": "example-governance-control",
  "name": "Example Governance Control",
  "version": "0.2.0",
  "manifest_version": "4",
  "license": "MIT",
  "commands": [
    {
      "id": "governance-demo",
      "name": "governance_demo",
      "description": "Read governance snapshots and command policy.",
      "usage": "/governance_demo",
      "permission": "everyone",
      "trigger": {
        "type": "exact",
        "names": [
          "governance_demo"
        ]
      }
    },
    {
      "id": "governance-block",
      "name": "governance_block",
      "description": "Add one user to the blacklist for demonstration.",
      "usage": "/governance_block <user_id>",
      "permission": "everyone",
      "trigger": {
        "type": "exact",
        "names": [
          "governance_block"
        ]
      }
    }
  ],
  "min_core_version": "0.7.0",
  "metadata": {
    "description": "Go example plugin demonstrating governance local actions.",
    "author": "raylea"
  },
  "events": [
    "message.group",
    "message.private"
  ]
}
