{
  "id": "example-scheduler",
  "name": "Example Scheduler",
  "version": "0.2.0",
  "manifest_version": "4",
  "license": "MIT",
  "commands": [
    {
      "id": "schedule-daily",
      "name": "schedule_daily",
      "description": "Create a daily scheduler.trigger task.",
      "usage": "/schedule_daily",
      "permission": "everyone",
      "trigger": {
        "type": "exact",
        "names": [
          "schedule_daily"
        ]
      }
    }
  ],
  "min_core_version": "0.7.0",
  "metadata": {
    "description": "Go example plugin demonstrating scheduler.create.",
    "author": "raylea"
  },
  "events": [
    "message.group",
    "scheduler.trigger"
  ]
}
