{
  "id": "example-webhook",
  "name": "Example Webhook",
  "version": "0.2.0",
  "manifest_version": "4",
  "license": "MIT",
  "commands": [],
  "min_core_version": "0.7.0",
  "metadata": {
    "description": "Go example plugin demonstrating route-forwarded webhooks with request headers and the raw body.",
    "author": "raylea"
  },
  "events": [
    "webhook.received"
  ],
  "webhooks": [
    {
      "id": "github",
      "route": "github"
    }
  ]
}
