{
  "id": "hello-go",
  "name": "Hello Go",
  "version": "0.2.0",
  "manifest_version": "4",
  "license": "MIT",
  "min_core_version": "0.7.0",
  "metadata": {
    "description": "Contract-aligned Go example plugin for the minimum init and event/result flow.",
    "author": "raylea",
    "icon": "assets/icon.svg",
    "repo": "https://github.com/RayleaBot/RayleaBot",
    "homepage": "https://rayleabot.local/plugins/hello-go",
    "keywords": [
      "hello",
      "example",
      "go"
    ],
    "screenshots": [
      {
        "path": "assets/preview.svg",
        "alt": "Hello Go preview"
      }
    ]
  },
  "events": [
    "message.group"
  ]
}
